{
  "sqft": 100,
  "rainwater": 40,
  "greywater": 40,
  "weeks": 20,
  "yields": [
    {
      "plant": "carrot",
      "min_yield": 10,
      "max_yield_pct": 0.25
    },
    {
      "plant": "tomato",
      "min_yield": 20,
      "max_yield_pct": 0.25,
      "max_yield": 100
    },
    {
      "plant": "corn",
      "min_yield": 10,
      "max_yield_pct": 0.25,
      "max_yield": 40
    },
    {
      "plant": "potato",
      "min_yield": 10,
      "max_yield_pct": 0.25
    },
    {
      "plant": "onion",
      "min_yield": 10,
      "max_yield_pct": 0.25
    }
  ]
}